barcode;dateaccessioned;booksellerid;homebranch;price;replacementprice;itemcallnumber;holdingbranch;title;author;isbn
1827;2018-08-07;;FING;;;47;FING;"IEEE Guide for medical ultrasound field parameter measurements.";;1559370343
3025;2018-08-07;;FING;;;47;FING;"IEEE Guide for medical ultrasound field parameter measurements.";;1559370343
3024;2018-08-07;;FING;;;31;FING;"IEEE Standard digital interface for programmable instrumentation.";;
3338;2018-08-07;;FING;;;25;FING;"IEEE standard for logic circuit diagrams.";;
3282;2018-08-07;;FING;;;52;FING;"Normas IRAM-IACC-ISO sobre gestión de la calidad 1994 :";;
2929;2018-08-07;;FING;;;52;FING;"Normas IRAM-IACC/ISO sobre gestión de la calidad 1994 :";;
